<?xml version="1.0"?>
<!DOCTYPE buyerProfile SYSTEM "buyerProfile.dtd">
<buyerProfile>
  <buyerProfileItem>
    <id>16</id>
    <full_name>buyer1</full_name>
    <username>buyer1</username>
    <mobile_number>123123</mobile_number>
    <email>buyer1@gmail.com</email>
    <address>buyer1buyer1</address>
    <role>buyer</role>
  </buyerProfileItem>
</buyerProfile>
